{
  "runId": "run-1778421164226-bygiam",
  "taskId": "task-1778421164210-6yirlp",
  "executorAgentId": "code-agent",
  "status": "completed",
  "summary": "OMNI_TEAM_RUNTIME_OK",
  "output": "OMNI_TEAM_RUNTIME_OK\n",
  "artifacts": [
    "L:\\Code\\Mastra-workspace\\OmniAgent\\docs\\runs\\code-runs\\code-1778421164196-xknu42.jsonl"
  ],
  "completedAt": "2026-05-10T13:52:59.385Z",
  "metadata": {
    "codeTaskId": "code-1778421164196-xknu42",
    "workspacePath": "L:\\Code\\Mastra-workspace\\OmniAgent",
    "stderr": "Warning: no stdin data received in 3s, proceeding without it. If piping from a slow command, redirect stdin explicitly: < /dev/null to skip, or wait longer.\n"
  }
}