{
  "runId": "run-1778421223453-hx9n4i",
  "taskId": "task-1778421223435-0721k0",
  "executorAgentId": "code-agent",
  "status": "completed",
  "summary": "OMNI_TEAM_CRON_OK",
  "output": "OMNI_TEAM_CRON_OK\n",
  "artifacts": [
    "L:\\Code\\Mastra-workspace\\OmniAgent\\docs\\runs\\code-runs\\code-1778421223431-t5llvs.jsonl"
  ],
  "completedAt": "2026-05-10T13:54:02.468Z",
  "metadata": {
    "codeTaskId": "code-1778421223431-t5llvs",
    "workspacePath": "L:\\Code\\Mastra-workspace\\OmniAgent",
    "stderr": "Warning: no stdin data received in 3s, proceeding without it. If piping from a slow command, redirect stdin explicitly: < /dev/null to skip, or wait longer.\n"
  }
}