{
  "runId": "run-1778425088734-yceqpz",
  "taskId": "task-1778425088704-z6ruk2",
  "executorAgentId": "code-agent",
  "status": "completed",
  "summary": "**OmniAgent 项目日报 — 2026-05-10**\n\n---\n\n**项目状态：非 Git 仓库，无 commit 记录可汇总。**\n\n---\n\n### 今日活动摘要\n\n| 时间 (UTC) | 事件 |\n|---|---|\n| 13:52 | 团队烟雾测试通过 — `OMNI_TEAM_RUNTIME_OK` |\n| 13:53 | Cron 团队集成测试通过 — `OMNI_TEAM_CRON_OK` |\n| 13:47-14:04 | 更新了 docs/agents/ 下全部 6 个 Agent 文档、TEAM_RUNTIME 知识库、OMNI 记忆 |\n| 13:48-13:51 | 新增 5 个 team 相关 JSON Schema（event/result/run/task/inbox-message） |\n| 14:58 | 当前日报 Cron 任务启动（正在运行中） |\n\n### 代码运行记录\n\n今日共触发 **10 次** CodeAgent 代码运行（`docs/runs/code-runs/`），其中：\n- 2 次为 Team Runtime 协调任务",
  "output": "**OmniAgent 项目日报 — 2026-05-10**\n\n---\n\n**项目状态：非 Git 仓库，无 commit 记录可汇总。**\n\n---\n\n### 今日活动摘要\n\n| 时间 (UTC) | 事件 |\n|---|---|\n| 13:52 | 团队烟雾测试通过 — `OMNI_TEAM_RUNTIME_OK` |\n| 13:53 | Cron 团队集成测试通过 — `OMNI_TEAM_CRON_OK` |\n| 13:47-14:04 | 更新了 docs/agents/ 下全部 6 个 Agent 文档、TEAM_RUNTIME 知识库、OMNI 记忆 |\n| 13:48-13:51 | 新增 5 个 team 相关 JSON Schema（event/result/run/task/inbox-message） |\n| 14:58 | 当前日报 Cron 任务启动（正在运行中） |\n\n### 代码运行记录\n\n今日共触发 **10 次** CodeAgent 代码运行（`docs/runs/code-runs/`），其中：\n- 2 次为 Team Runtime 协调任务（已完成）\n- 1 次为当前日报任务（运行中）\n- 7 次为开发调试/功能验证运行\n\n### 项目结构概览\n\n```\nsrc/mastra/\n  agents/     — 5 个 Agent（Router, Code, Cron, Knowledge, Task）\n  tools/      — code-tools, cron-tools, memory-tools, team-runtime-tools, team-tools\n  lib/        — code-task-store, cron-store, docs-memory, team-runtime-store, paths\n  workflows/  — code-task-workflow, memory-maintenance-workflow\ndocs/\n  memory/     — 6 个记忆文件（USER, PREFERENCES, WORKSPACE, DECISIONS, EPISODIC_LOG, CURRENT_CONTEXT）\n  knowledge/  — 7 个知识库条目\n  agents/     — 5 个 Agent 文档\n  schemas/    — 11 个 JSON Schema\n  runs/       — 运行时日志和结果\n```\n\n### 待完成项（来自 CURRENT_CONTEXT）\n\n1. 持久化 Cron 执行循环\n2. 对 `docs/` 添加向量/全文索引\n3. MemoryMaintenanceWorkflow 稳定后上线\n4. CodeAgent 实时进度流（替代轮询）\n\n---\n\n**结论：** 今日为项目启动首日（2026-05-10），完成了 Agent 团队基础架构搭建、Team Runtime 通信验证、Cron 集成测试，以及文档体系的初始化。项目处于积极开发状态，核心工作流已跑通。\n",
  "artifacts": [
    "L:\\Code\\Mastra-workspace\\OmniAgent\\docs\\runs\\code-runs\\code-1778425088681-u2eosq.jsonl"
  ],
  "completedAt": "2026-05-10T15:00:40.842Z",
  "metadata": {
    "codeTaskId": "code-1778425088681-u2eosq",
    "workspacePath": "L:\\Code\\Mastra-workspace\\OmniAgent",
    "stderr": "Warning: no stdin data received in 3s, proceeding without it. If piping from a slow command, redirect stdin explicitly: < /dev/null to skip, or wait longer.\nSessionEnd hook [node \"$CLAUDE_PLUGIN_ROOT\"/scripts/run.cjs \"$CLAUDE_PLUGIN_ROOT\"/scripts/session-end.mjs] failed: Hook cancelled\n"
  }
}